{
  "id": "mobi",
  "version": "1.0.0",
  "title": "Open-Systems-Pharmacology/MoBi pinned source v12.3.136",
  "repository": "https://github.com/Open-Systems-Pharmacology/MoBi",
  "commit": "7f1094cb5b858d001afa5f2fff1c0b6509a345c5",
  "license": "GPLv2 plus OSP Clarifying Addendum (bundled PDF)",
  "license_files": [
    "Open Systems Pharmacology Suite License.pdf"
  ],
  "capabilities": [
    "systems_pharmacology",
    "pbpk"
  ],
  "limitations": [
    "Source snapshot inspected separately from runtime installation, adapter readiness and biological validity.",
    "Submodule Git links and LFS pointers, if present, are inventoried and remain unresolved until explicitly acquired.",
    "Pristine upstream source is preserved; optimizations require a separate patch/model version and frozen benchmarks."
  ]
}
